{
  "threshold_name": "pricing.default_margin_floor",
  "version": "v1",
  "status": "draft",
  "bounded_context": "pricing",
  "scope": [
    "global",
    "environment",
    "tenant",
    "module",
    "entity/profile"
  ],
  "description": "Defines the minimum pricing margin floor resolved across runtime governance scopes.",
  "schema_ref": "../../api/jsonschema/governance_threshold_v1.schema.json"
}
